{
  "$schema": "https://json-schema.org/draft/2020-12/schema",
  "$id": "https://github.com/haitaowu12/personal-growth-copilot/community-supplement.schema.json",
  "title": "Community pattern and adoption supplement",
  "type": "object",
  "additionalProperties": false,
  "required": [
    "schema_version",
    "review_date",
    "status",
    "policy",
    "sources"
  ],
  "properties": {
    "schema_version": {
      "const": "1.0"
    },
    "review_date": {
      "type": "string",
      "format": "date"
    },
    "status": {
      "const": "candidate_supplement"
    },
    "policy": {
      "type": "string",
      "minLength": 1,
      "maxLength": 2000
    },
    "sources": {
      "type": "array",
      "minItems": 5,
      "maxItems": 50,
      "items": {
        "$ref": "#/$defs/source"
      }
    }
  },
  "$defs": {
    "source": {
      "type": "object",
      "additionalProperties": false,
      "required": [
        "repository",
        "commit",
        "license",
        "category",
        "adoption_signal",
        "maintenance_signal",
        "quality_evidence",
        "outcome_evidence",
        "transferable_patterns",
        "patterns_to_reject",
        "disposition",
        "claim_limit"
      ],
      "properties": {
        "repository": {
          "type": "string",
          "format": "uri",
          "pattern": "^https://github.com/"
        },
        "commit": {
          "type": "string",
          "pattern": "^[0-9a-f]{40}$"
        },
        "license": {
          "type": "string",
          "minLength": 1,
          "maxLength": 120
        },
        "category": {
          "enum": [
            "direct-coaching-skill",
            "coaching-research-prototype",
            "evaluation-platform",
            "memory-platform",
            "stateful-agent-platform",
            "self-hosted-assistant"
          ]
        },
        "adoption_signal": {
          "type": "object",
          "additionalProperties": false,
          "required": [
            "stars_at_review",
            "forks_at_review",
            "observed_at"
          ],
          "properties": {
            "stars_at_review": {
              "type": "integer",
              "minimum": 0
            },
            "forks_at_review": {
              "type": "integer",
              "minimum": 0
            },
            "observed_at": {
              "type": "string",
              "format": "date"
            }
          }
        },
        "maintenance_signal": {
          "type": "object",
          "additionalProperties": false,
          "required": [
            "last_push_at",
            "status"
          ],
          "properties": {
            "last_push_at": {
              "type": "string",
              "format": "date-time"
            },
            "status": {
              "enum": [
                "active",
                "research-prototype-not-maintained",
                "limited-evidence",
                "legacy-development-moved"
              ]
            }
          }
        },
        "quality_evidence": {
          "type": "array",
          "minItems": 1,
          "maxItems": 12,
          "items": {
            "type": "string",
            "minLength": 1,
            "maxLength": 700
          }
        },
        "outcome_evidence": {
          "type": "string",
          "minLength": 1,
          "maxLength": 1200
        },
        "transferable_patterns": {
          "type": "array",
          "minItems": 1,
          "maxItems": 12,
          "items": {
            "type": "string",
            "minLength": 1,
            "maxLength": 700
          }
        },
        "patterns_to_reject": {
          "type": "array",
          "minItems": 1,
          "maxItems": 12,
          "items": {
            "type": "string",
            "minLength": 1,
            "maxLength": 700
          }
        },
        "disposition": {
          "enum": [
            "ADOPT_TOOLING",
            "ADAPT_CLEAN_ROOM",
            "ARCHITECTURE_ONLY"
          ]
        },
        "claim_limit": {
          "type": "string",
          "minLength": 1,
          "maxLength": 1000
        }
      }
    }
  }
}
