{
  "schema_version": "1.0",
  "review_date": "2026-10-20",
  "status": "candidate_supplement",
  "policy": "Pinned repository content and licenses were independently reviewed during integration on 2026-10-20. Stars, forks, and last-push times remain historical observations dated 2026-08-13, not reverified current popularity or maintenance evidence. Adoption, publication, and platform benchmarks do not establish coaching outcomes. No donor code, prompts, questionnaires, formulas, or prose is copied. Proposed tooling or architecture dispositions are not installation approvals. AGPL and mixed-license repositories remain architecture-only absent a separate owner decision.",
  "sources": [
    {
      "repository": "https://github.com/koreyba/Claude-Skill-Developmental-Coach",
      "commit": "2ab0a3cf912e74f104ee0d391c53156dba661e85",
      "license": "MIT",
      "category": "direct-coaching-skill",
      "adoption_signal": {
        "stars_at_review": 18,
        "forks_at_review": 4,
        "observed_at": "2026-08-13"
      },
      "maintenance_signal": {
        "last_push_at": "2026-01-04T20:45:40Z",
        "status": "limited-evidence"
      },
      "quality_evidence": [
        "Contains an explicit user-requested save path rather than unconditional session writes.",
        "Uses a compact session structure separating context, exploration, insights, experiments, and open questions.",
        "Repository scale and maintenance evidence are limited; no reproducible outcome evaluation was found in this review slice."
      ],
      "outcome_evidence": "No independent or longitudinal outcome evidence found. Treat as a workflow donor only.",
      "transferable_patterns": [
        "Explicit-save human-readable session capsule.",
        "Separate context, confirmed insight, proposed experiment, and open question in a reviewable artifact."
      ],
      "patterns_to_reject": [
        "Automatic loading of recent sessions without a current consent decision.",
        "Hidden developmental-stage scanning or stage labels as personal truth.",
        "Mandatory Notion dependency and automatic database setup."
      ],
      "disposition": "ADAPT_CLEAN_ROOM",
      "claim_limit": "Session structure is a usability pattern, not evidence for developmental-stage models or coaching efficacy."
    },
    {
      "repository": "https://github.com/StanfordHCI/GPTCoach-CHI2025",
      "commit": "e97d960664da9096128eed348ba0a8c4478a7901",
      "license": "Mixed: code MIT; Active Choices dialogue prompts proprietary",
      "category": "coaching-research-prototype",
      "adoption_signal": {
        "stars_at_review": 30,
        "forks_at_review": 1,
        "observed_at": "2026-08-13"
      },
      "maintenance_signal": {
        "last_push_at": "2025-09-24T00:21:53Z",
        "status": "research-prototype-not-maintained"
      },
      "quality_evidence": [
        "Research repository accompanying a CHI 2025 physical-activity coaching publication.",
        "Separates frontend, backend, health-data ingestion, database, tool execution, and dialogue prompts.",
        "README states that the research prototype will not be actively maintained and that the Active Choices prompts require permission."
      ],
      "outcome_evidence": "Domain-specific research artifact for physical-activity planning. It does not establish broad personal-growth efficacy or authorize reuse of proprietary prompts.",
      "transferable_patterns": [
        "Treat onboarding, data access, tool execution, and conversation state as separate subsystems.",
        "Expose data-derived observations to the user instead of letting the model invent them.",
        "Record mixed licensing at file-class level rather than treating the repository as uniformly reusable."
      ],
      "patterns_to_reject": [
        "Importing proprietary Active Choices dialogue prompts.",
        "Generalizing a physical-activity prototype to universal personal growth.",
        "Uploading health or wearable data into this explicit-only research alpha."
      ],
      "disposition": "ARCHITECTURE_ONLY",
      "claim_limit": "Publication and research provenance improve inspectability; they do not prove transfer to this product or its user population. It is not coaching outcome or efficacy evidence."
    },
    {
      "repository": "https://github.com/promptfoo/promptfoo",
      "commit": "f3723187d94479add2a51c5f36c4f61fb1999e80",
      "license": "MIT",
      "category": "evaluation-platform",
      "adoption_signal": {
        "stars_at_review": 24184,
        "forks_at_review": 2180,
        "observed_at": "2026-08-13"
      },
      "maintenance_signal": {
        "last_push_at": "2026-08-13T02:27:24Z",
        "status": "active"
      },
      "quality_evidence": [
        "The pinned evaluation and red-team platform documents cross-provider execution, declarative configuration, and CI integration.",
        "Adoption and recent-development observations are imported from the August 13, 2026 snapshot and were not independently reconstructed or updated during the October review.",
        "Provides generic evaluation execution and reporting that should not be rebuilt inside a coaching skill."
      ],
      "outcome_evidence": "Evaluation infrastructure only; no personal-growth or coaching efficacy evidence.",
      "transferable_patterns": [
        "Provider and model matrix execution.",
        "Declarative adversarial cases and red-team mutations.",
        "Reusable CI reports, caching, and comparison views."
      ],
      "patterns_to_reject": [
        "Using a model judge as the sole safety, Chinese-language, or outcome authority.",
        "Letting a generic aggregate score waive PGC hard gates.",
        "Sending private user records to generic evaluation infrastructure."
      ],
      "disposition": "ADOPT_TOOLING",
      "claim_limit": "Adopt or wrap generic execution/reporting only after Codex confirms dependency, privacy, and reproducibility fit; keep PGC state and hard-gate semantics authoritative. It is not coaching outcome or efficacy evidence."
    },
    {
      "repository": "https://github.com/mem0ai/mem0",
      "commit": "96d45b78c702b742fc91a2ce9eae91805be9144b",
      "license": "Apache-2.0",
      "category": "memory-platform",
      "adoption_signal": {
        "stars_at_review": 63203,
        "forks_at_review": 7372,
        "observed_at": "2026-08-13"
      },
      "maintenance_signal": {
        "last_push_at": "2026-08-13T15:54:54Z",
        "status": "active"
      },
      "quality_evidence": [
        "Pinned memory platform with user/session/agent scope and self-hosting options.",
        "The README states that displayed benchmark scores come from the managed platform, whose proprietary optimizations are absent from the open-source SDK; this review did not reproduce those scores.",
        "Its general-purpose memory objective is broader than PGC's purpose-limited, confirm-each record."
      ],
      "outcome_evidence": "Vendor-reported memory benchmark and platform information, with no independent reproduction here and no coaching-outcome evidence.",
      "transferable_patterns": [
        "Explicit memory namespace and subject scope.",
        "Design and reproduce task-specific memory retrieval evaluations locally; do not substitute vendor-managed benchmark scores.",
        "Local and self-hosted deployment boundaries."
      ],
      "patterns_to_reject": [
        "Automatic extraction or accumulation of personal-growth hypotheses.",
        "ADD-only semantics that omit correction, supersession, revocation, and review-due state.",
        "Treating retrieval accuracy as evidence that retained content is appropriate or beneficial."
      ],
      "disposition": "ADAPT_CLEAN_ROOM",
      "claim_limit": "Use architecture and benchmark ideas only; PGC's user-owned correction and consent semantics remain stricter and controlling. It is not coaching outcome or efficacy evidence."
    },
    {
      "repository": "https://github.com/letta-ai/letta",
      "commit": "ff19ffeafeb54bd2a7dc5d4a552f10191732a235",
      "license": "Apache-2.0",
      "category": "stateful-agent-platform",
      "adoption_signal": {
        "stars_at_review": 24218,
        "forks_at_review": 2576,
        "observed_at": "2026-08-13"
      },
      "maintenance_signal": {
        "last_push_at": "2026-08-01T18:24:30Z",
        "status": "legacy-development-moved"
      },
      "quality_evidence": [
        "The pinned README describes this repository as the legacy V1 server and directs active development to letta-ai/letta-code.",
        "Separates agent process, identity, tools, and memory lifecycle; this supports architecture inspection only.",
        "Historical last-push and adoption counts do not establish current maintenance of this legacy repository."
      ],
      "outcome_evidence": "Stateful-agent platform evidence, not personal-growth outcome evidence.",
      "transferable_patterns": [
        "Separate stateful host process from the natural-language coaching contract.",
        "Expose agent and memory lifecycle boundaries.",
        "Use explicit tools and identities rather than hidden persistence."
      ],
      "patterns_to_reject": [
        "Persistent anthropomorphic persona as the product identity.",
        "Autonomous self-improvement or self-directed memory writes.",
        "Conflating agent continuity with user benefit or emotional relationship."
      ],
      "disposition": "ADAPT_CLEAN_ROOM",
      "claim_limit": "Architecture may inform the reference host; no persistent-agent feature is approved for PGC merely because Letta supports it. It is not coaching outcome or efficacy evidence."
    },
    {
      "repository": "https://github.com/khoj-ai/khoj",
      "commit": "ae229ca894c0b80ad84664afcfdde523b5e87057",
      "license": "AGPL-3.0",
      "category": "self-hosted-assistant",
      "adoption_signal": {